{
  "annotations_sha256": "6c21a9691dd11b2a1b92e695353cda38405032451e79245ede913ab9de59c2b7",
  "nebula_entry_count": 156,
  "parameter_count": 78,
  "parameters": [
    {
      "annotation": {
        "evidence": [
          "torchsynth/module.py:ADSR.ramp"
        ],
        "interpretation": "continuous",
        "meaning": "Ramp-shaping exponent of the envelope feeding the modulation matrix.",
        "notes": "No physical unit. This shapes the envelope signal, independently of the parameter-range curve hyperparameter.",
        "selector": "none",
        "unit": "dimensionless"
      },
      "curve": 1,
      "default_frozen": false,
      "forward_position": 6,
      "frozen_capable": true,
      "maximum": 6.0,
      "minimum": 0.1,
      "module": "adsr_1",
      "module_class": "ADSR",
      "name": "adsr_1.alpha",
      "parameter": "alpha",
      "randomization_position": 0,
      "source_description": "envelope curve. 1 is linear, >1 is exponential.",
      "symmetric": false,
      "torch_name": "adsr_1.torchparameters.alpha"
    },
    {
      "annotation": {
        "evidence": [
          "torchsynth/module.py:ADSR"
        ],
        "interpretation": "continuous",
        "meaning": "Attack time of the envelope feeding the modulation matrix.",
        "notes": "Continuous requested duration; control-rate sample conversion and note-duration truncation remain upstream behavior.",
        "selector": "none",
        "unit": "seconds"
      },
      "curve": 0.5,
      "default_frozen": false,
      "forward_position": 2,
      "frozen_capable": true,
      "maximum": 2.0,
      "minimum": 0.0,
      "module": "adsr_1",
      "module_class": "ADSR",
      "name": "adsr_1.attack",
      "parameter": "attack",
      "randomization_position": 1,
      "source_description": "attack time (sec)",
      "symmetric": false,
      "torch_name": "adsr_1.torchparameters.attack"
    },
    {
      "annotation": {
        "evidence": [
          "torchsynth/module.py:ADSR"
        ],
        "interpretation": "continuous",
        "meaning": "Decay time of the envelope feeding the modulation matrix.",
        "notes": "Continuous requested duration; control-rate sample conversion and note-duration truncation remain upstream behavior.",
        "selector": "none",
        "unit": "seconds"
      },
      "curve": 0.5,
      "default_frozen": false,
      "forward_position": 3,
      "frozen_capable": true,
      "maximum": 2.0,
      "minimum": 0.0,
      "module": "adsr_1",
      "module_class": "ADSR",
      "name": "adsr_1.decay",
      "parameter": "decay",
      "randomization_position": 2,
      "source_description": "decay time (sec)",
      "symmetric": false,
      "torch_name": "adsr_1.torchparameters.decay"
    },
    {
      "annotation": {
        "evidence": [
          "torchsynth/module.py:ADSR"
        ],
        "interpretation": "continuous",
        "meaning": "Release time of the envelope feeding the modulation matrix.",
        "notes": "Continuous requested duration; control-rate sample conversion and note-duration truncation remain upstream behavior.",
        "selector": "none",
        "unit": "seconds"
      },
      "curve": 0.5,
      "default_frozen": false,
      "forward_position": 5,
      "frozen_capable": true,
      "maximum": 5.0,
      "minimum": 0.0,
      "module": "adsr_1",
      "module_class": "ADSR",
      "name": "adsr_1.release",
      "parameter": "release",
      "randomization_position": 3,
      "source_description": "release time (sec)",
      "symmetric": false,
      "torch_name": "adsr_1.torchparameters.release"
    },
    {
      "annotation": {
        "evidence": [
          "torchsynth/module.py:ADSR"
        ],
        "interpretation": "continuous",
        "meaning": "Sustain amplitude of the envelope feeding the modulation matrix.",
        "notes": "A relative amplitude in [0, 1], not a duration or decibel value.",
        "selector": "none",
        "unit": "dimensionless"
      },
      "curve": 1,
      "default_frozen": false,
      "forward_position": 4,
      "frozen_capable": true,
      "maximum": 1.0,
      "minimum": 0.0,
      "module": "adsr_1",
      "module_class": "ADSR",
      "name": "adsr_1.sustain",
      "parameter": "sustain",
      "randomization_position": 4,
      "source_description": "sustain amplitude 0-1. The only part of ADSR that (confusingly, by convention) is not a time value.",
      "symmetric": false,
      "torch_name": "adsr_1.torchparameters.sustain"
    },
    {
      "annotation": {
        "evidence": [
          "torchsynth/module.py:ADSR.ramp"
        ],
        "interpretation": "continuous",
        "meaning": "Ramp-shaping exponent of the envelope feeding the modulation matrix.",
        "notes": "No physical unit. This shapes the envelope signal, independently of the parameter-range curve hyperparameter.",
        "selector": "none",
        "unit": "dimensionless"
      },
      "curve": 1,
      "default_frozen": false,
      "forward_position": 11,
      "frozen_capable": true,
      "maximum": 6.0,
      "minimum": 0.1,
      "module": "adsr_2",
      "module_class": "ADSR",
      "name": "adsr_2.alpha",
      "parameter": "alpha",
      "randomization_position": 5,
      "source_description": "envelope curve. 1 is linear, >1 is exponential.",
      "symmetric": false,
      "torch_name": "adsr_2.torchparameters.alpha"
    },
    {
      "annotation": {
        "evidence": [
          "torchsynth/module.py:ADSR"
        ],
        "interpretation": "continuous",
        "meaning": "Attack time of the envelope feeding the modulation matrix.",
        "notes": "Continuous requested duration; control-rate sample conversion and note-duration truncation remain upstream behavior.",
        "selector": "none",
        "unit": "seconds"
      },
      "curve": 0.5,
      "default_frozen": false,
      "forward_position": 7,
      "frozen_capable": true,
      "maximum": 2.0,
      "minimum": 0.0,
      "module": "adsr_2",
      "module_class": "ADSR",
      "name": "adsr_2.attack",
      "parameter": "attack",
      "randomization_position": 6,
      "source_description": "attack time (sec)",
      "symmetric": false,
      "torch_name": "adsr_2.torchparameters.attack"
    },
    {
      "annotation": {
        "evidence": [
          "torchsynth/module.py:ADSR"
        ],
        "interpretation": "continuous",
        "meaning": "Decay time of the envelope feeding the modulation matrix.",
        "notes": "Continuous requested duration; control-rate sample conversion and note-duration truncation remain upstream behavior.",
        "selector": "none",
        "unit": "seconds"
      },
      "curve": 0.5,
      "default_frozen": false,
      "forward_position": 8,
      "frozen_capable": true,
      "maximum": 2.0,
      "minimum": 0.0,
      "module": "adsr_2",
      "module_class": "ADSR",
      "name": "adsr_2.decay",
      "parameter": "decay",
      "randomization_position": 7,
      "source_description": "decay time (sec)",
      "symmetric": false,
      "torch_name": "adsr_2.torchparameters.decay"
    },
    {
      "annotation": {
        "evidence": [
          "torchsynth/module.py:ADSR"
        ],
        "interpretation": "continuous",
        "meaning": "Release time of the envelope feeding the modulation matrix.",
        "notes": "Continuous requested duration; control-rate sample conversion and note-duration truncation remain upstream behavior.",
        "selector": "none",
        "unit": "seconds"
      },
      "curve": 0.5,
      "default_frozen": false,
      "forward_position": 10,
      "frozen_capable": true,
      "maximum": 5.0,
      "minimum": 0.0,
      "module": "adsr_2",
      "module_class": "ADSR",
      "name": "adsr_2.release",
      "parameter": "release",
      "randomization_position": 8,
      "source_description": "release time (sec)",
      "symmetric": false,
      "torch_name": "adsr_2.torchparameters.release"
    },
    {
      "annotation": {
        "evidence": [
          "torchsynth/module.py:ADSR"
        ],
        "interpretation": "continuous",
        "meaning": "Sustain amplitude of the envelope feeding the modulation matrix.",
        "notes": "A relative amplitude in [0, 1], not a duration or decibel value.",
        "selector": "none",
        "unit": "dimensionless"
      },
      "curve": 1,
      "default_frozen": false,
      "forward_position": 9,
      "frozen_capable": true,
      "maximum": 1.0,
      "minimum": 0.0,
      "module": "adsr_2",
      "module_class": "ADSR",
      "name": "adsr_2.sustain",
      "parameter": "sustain",
      "randomization_position": 9,
      "source_description": "sustain amplitude 0-1. The only part of ADSR that (confusingly, by convention) is not a time value.",
      "symmetric": false,
      "torch_name": "adsr_2.torchparameters.sustain"
    },
    {
      "annotation": {
        "evidence": [
          "torchsynth/module.py:MonophonicKeyboard.forward",
          "torchsynth/synth.py:Voice.output"
        ],
        "interpretation": "continuous",
        "meaning": "Known note-on duration supplied to all six envelopes.",
        "notes": "Continuous note duration within the fixed four-second clip; this is not a live note-off event or a clip-length parameter.",
        "selector": "none",
        "unit": "seconds"
      },
      "curve": 0.5,
      "default_frozen": false,
      "forward_position": 1,
      "frozen_capable": true,
      "maximum": 4.0,
      "minimum": 0.01,
      "module": "keyboard",
      "module_class": "MonophonicKeyboard",
      "name": "keyboard.duration",
      "parameter": "duration",
      "randomization_position": 10,
      "source_description": "note-on button, in seconds",
      "symmetric": false,
      "torch_name": "keyboard.torchparameters.duration"
    },
    {
      "annotation": {
        "evidence": [
          "torchsynth/module.py:MonophonicKeyboard.forward",